0|13;0|37,
<command:background:MrsJTFSchool><command:change_view:ms-t-tf><N17>[I guess my mouth just wasn't enough.]|<N17>[But should I really be doing this with a student.]|<N17>[But if I don't he will tell everyone what we have done.];<command:change_speed:4><N1>This feels really good N<17>.|<N1>Your breasts are fucking great.|<N17>I'd rather you not talk like that N<1>.;<command:change_speed:3><N17>[He's enjoying this too much.]|<N17>[Well all men do love breasts regardless of age.]|<N17>N<1> are we almost done here?;<command:change_speed:2><N1>Yeah I'm close N<17>.|<N1>Your tits are gonna make me cum!|<N1>I'm gonna shot all over them!|<N17>[This is gonna be messy....];<command:insert_sound:sex - Cumshot 4|80|100|1><command:change_view:ms-t-tf-cum><command:disable_loop><N17>[It's all over me but at least this problem is solved.]|<N1>Thanks for the titfuck N<17>. I'll be back for another one tomorrow!|<N17>[Oh no! This can't go on!]
<command:background:MrsJTFSchool><command:change_view:ms-t-tf><N17>[So we are doing this again.]|<N17>[Fucking brat, I'll get back at him somehow]|<N17>[But what can I do?];<command:change_speed:4><N1>That's right slide my cock between your tits.|<N1>Bet it feels as good for you as it does for me!|<N1>Though I'm thinking you can do better than this!;<command:change_speed:3><N17>[I wish he'd just shut up]|<N17>[He's already got me doing this shit, he doesn't have to be a jerk about it!]|<N17>[I wish he'd just cum already!];<command:change_speed:2><N1>I'm going to cum N<17>.|<N17>[Finally!]|<N17>Hurry up and do it.;<command:insert_sound:sex - Cumshot 4|80|100|1><command:change_view:ms-t-tf-cum><command:disable_loop><N17>[I'm covered in his cum again.]|<N17>[It kinda feels nice.]|<N17>[What am I thinking? I can't like this!]
<command:background:MrsJTFSchool><command:change_view:ms-t-tf><N17>[Back at it again Trish.]|<N17>[I can't believe this is still going on.]|<N17>[And now I'm starting to like it too.];<command:change_speed:4><N1>I bet you like doing this don'tcha N<17>?|<N1>I know I do!|<N17>[I do, but no way in hell I'm tell him that.];<command:change_speed:3><N17>[Oh god, I just admitted that to myself!]|<N17>[What has become of me?]|<N1>I know you like it, you'll admit it any day now.;<command:change_speed:2><N1>I'm going to cum now N<17>.|<N1>Get ready to take it all over you!|<N17>[I'm used to getting covered now.];<command:insert_sound:sex - Cumshot 4|80|100|1><command:change_view:ms-t-tf-cum><command:disable_loop><N17>[Oh god this feels nice!]|<N17>[Maybe I should admit it?]|<N17>[What's the worst that could happen?]
<command:background:MrsJTFSchool><command:change_view:ms-t-tf><N17>Oh yes N<1>! Fuck my tits!|<N17>I love feeling your cock between my breasts!|<N17>Keep thrusting your massive rod!;<command:change_speed:4><N1>I knew you loved it!|<N1>Now you can truly enjoy yourself.|<N17>[I can't help the fact that I love it so much.];<command:change_speed:3><N17>Alright I'll admit it feels really good for me.|<N1>Well if you like it so much then we can do it everyday now.|<N17>Yes please N<1>. Every single day!;<command:change_speed:2><N1>I'm going to cum soon.|<N17>Go ahead and cover me with your seed.|<N17>I want to feel it on my skin.;<command:insert_sound:sex - Cumshot 4|80|100|1><command:change_view:ms-t-tf-cum><command:disable_loop><N17>Oh I love the feeling of being covered.|<N17>Make sure you do this again tomorrow alright.|<N1>I promise, only cause you've been a good little cum slut.|<N17>Thank you~
<command:background:MrsJTFSchool><command:change_view:ms-t-tf><N17>Oh yes N<1>! Fuck my tits!|<N17>I love feeling your cock between my breasts!|<N17>Keep thrusting your massive rod!;<command:change_speed:4><N1>I knew you loved it!|<N1>Now you can truly enjoy yourself.|<N17>[I can't help the fact that I love it so much.];<command:change_speed:3><N17>Alright I'll admit it feels really good for me.|<N1>Well if you like it so much then we can do it everyday now.|<N17>Yes please N<1>. Every single day!;<command:change_speed:2><N1>I'm going to cum soon.|<N17>Go ahead and cover me with your seed.|<N17>I want to feel it on my skin.;<command:insert_sound:sex - Cumshot 4|80|100|1><command:change_view:ms-t-tf-cum><command:disable_loop><N17>Oh I love the feeling of being covered.|<N17>Make sure you do this again tomorrow alright.|<N1>I promise, only cause you've been a good little cum slut.|<N17>Thank you~
