2|3;2|17;2|30;2|41;2|53
<command:background:Forest><command:change_view:ms-t-doggy><N1>Fuck! Your pussy is really tight, Bitch!|<N1>I should have just done this to start with.|<N17>Ruff, woof woof!;<command:change_speed:4><N1>Yeah, take my cock, slut!|<N1>You're nothing but a fucking *whore* now!|<N17>Woof woof woof woof woof!.;<command:change_speed:3><N1>You like it when I do this, huh?!|<N17>[Oh God, I'm going to break, he's tearing me in half!];<command:change_speed:2><N17>Fuck, fuck, yes-s-s-s!|<N17>Arrooooooo!|<N1>Did my Bitch cum without my permission again?!|<N1>Guess I'm gonna have to cum inside of her to teach her a lesson she won't forget!|<N17>Woof, woof, arroooooo-;<command:change_view:ms-t-doggy-cum><command:insert_sound:sex - Cumshot 4|100|100|1><command:disable_loop><N17>Haaahh... Hahhhnnn... |<N1>Don't get too comfortable, Bitch!|<N1>We're doing this again, and again, and again!|<N17>[So full... I love... N<22>'s cock...]
<command:background:Forest><command:change_view:ms-t-doggy><N1>Mmgh, yeah! You're such a slut, now!|<N1>You must've really wanted this, you're soaked right through!|<N17>Mmf, hmmf, nngh!;<command:change_speed:4><N17>[N<22>'s cock, N<22>'s Cock, N<22>'s COCK!]|<N17>[More, more! Break me, N<22>!]|<N1>Hang on, I'm gonna go even faster!;<command:change_speed:3><N1>Admit it, Bitch! You're addicted to my cock!|<N17>Woof, woof!|<N1>I can't hear you - scream it out for me, Bitch!;<command:change_speed:2><N17>Y-YEESSSSS! I'M IN LOVE WITH YOUR COCK, N<22>!|<N1>Ha ha ha! You bad Bitch, you're gonna get punished for speaking again!|<N17>Yes, yes! Punish me, N<22>, I deserve it, I'm just a bad Bitch!!;<command:change_view:ms-t-doggy-cum><command:insert_sound:sex - Cumshot 4|100|100|1><command:disable_loop><N17>[My mind... is... blank...]|<N17>[It always... feels... so good...!]|<N1>I'm starting to enjoy our "walks" together!
<command:background:Forest><command:change_view:ms-t-doggy><N17>Woof, woof, woof! AROOOO!|<N1>You came already?!|<N1>You must've been aching for this! Right?!|<N17>[All day, N<22>! It's never enough!];<command:change_speed:4><N1>I love this fat ass of yours, Bitch!|<N1>Let's do it a bunch more when we get back!|<N17>WOOF WOOF WOOF!|<N17>[I'll die a happy woman if he fucks my ass like he's fucking my pussy!];<command:change_speed:2><N17>Mmmmfh... HHNNNGHHH...!|<N1>You like it hard?!|<N1>Then I'm gonna give you everything I've got!|<N17>YEEESSSSSS!.;<command:change_speed:2><N1>G-Get ready, Bitch! It's gonna be a big one!|<N17>Yes, N<22>! CUM INSIDE OF MY CUNT!;<command:change_view:ms-t-doggy-cum><command:insert_sound:sex - Cumshot 4|100|100|1><command:disable_loop><N1>W-Woah... that was intense, Bitch.|<N1>Let's do it like that next time, too!|<N17>Yes... anything... N<22>...
<command:background:Forest><command:change_view:ms-t-doggy><N17>Woof, woof, woof! AROOOO!|<N1>You came already?!|<N1>You must've been aching for this! Right?!|<N17>[All day, N<22>! It's never enough!];<command:change_speed:4><N1>I love this fat ass of yours, Bitch!|<N1>Let's do it a bunch more when we get back!|<N17>WOOF WOOF WOOF!|<N17>[I'll die a happy woman if he fucks my ass like he's fucking my pussy!];<command:change_speed:2><N17>Mmmmfh... HHNNNGHHH...!|<N1>You like it hard?!|<N1>Then I'm gonna give you everything I've got!|<N17>YEEESSSSSS!.;<command:change_speed:2><N1>G-Get ready, Bitch! It's gonna be a big one!|<N17>Yes, N<22>! CUM INSIDE OF MY CUNT!;<command:change_view:ms-t-doggy-cum><command:insert_sound:sex - Cumshot 4|100|100|1><command:disable_loop><N1>W-Woah... that was intense, Bitch.|<N1>Let's do it like that next time, too!|<N17>Yes... anything... N<22>...
<command:background:Forest><command:change_view:ms-t-doggy><N17>Woof, woof, woof! AROOOO!|<N1>You came already?!|<N1>You must've been aching for this! Right?!|<N17>[All day, N<22>! It's never enough!];<command:change_speed:4><N1>I love this fat ass of yours, Bitch!|<N1>Let's do it a bunch more when we get back!|<N17>WOOF WOOF WOOF!|<N17>[I'll die a happy woman if he fucks my ass like he's fucking my pussy!];<command:change_speed:2><N17>Mmmmfh... HHNNNGHHH...!|<N1>You like it hard?!|<N1>Then I'm gonna give you everything I've got!|<N17>YEEESSSSSS!.;<command:change_speed:2><N1>G-Get ready, Bitch! It's gonna be a big one!|<N17>Yes, N<22>! CUM INSIDE OF MY CUNT!;<command:change_view:ms-t-doggy-cum><command:insert_sound:sex - Cumshot 4|100|100|1><command:disable_loop><N1>W-Woah... that was intense, Bitch.|<N1>Let's do it like that next time, too!|<N17>Yes... anything... N<22>...