1|11;1|33
<command:background:Desk><command:change_view:ms-t-bj><command:change_speed:4><N17>[I can't believe those childish rumors were true!]|<N17>[How can this be so huge?]|<N17>[And how can I be sucking it right now!?|<N1>N<17> this feels really good!|<N17>[I'd rather he not talk during this.];<command:change_speed:3><N1>Thank you for doing this N<17>|<N17>Mhhmmm mhhmmm|<N1>I'll take that as a your welcome.;<command:change_speed:2><N17>[I have to end this quickly before anyone walks in.]|<N1>*N<17>... If you go that fast I'm gonna...*|<N17>[That's the plan N<1>...];<command:change_speed:1><N17>[I still can't quite get over how big his dick is...]|<N17>[And how easily I'm sucking it...]|<N1>*N<17>! I'm gonna...*;<command:change_view:ms-t-bj-cum><command:disable_loop><N17>[I should have expected there being a lot.....]|<N17>[Given how big it is.]|<N1>*That felt great N<17>*|<N17>[It actually felt good for me too...]
<command:background:Desk><command:change_view:ms-t-bj><command:change_speed:4><N17>[I can't believe he asked for this again.]|<N17>[You really opened up a can of worms Trish.]|<N17>[But it is turning me on a bit...]|<N1>You're the best N<17>, helping me like this.|<N17>[Him being all sweet does make this better.];<command:change_speed:3><N17>[But this gotta be the last time.]|<N17>[We can't make this a habit.]|<N17>[No matter how much I'm starting to like it....};<command:change_speed:2><N17>[I need to stop thinking about this and end it.]|<N1>*N<17>... If you go that fast I'm gonna...*|<N17>[Yes! Hurry up and cum!];<command:change_speed:1><N17>[Gotta make this big dick cum in my mouth again....]|<N17>[Maybe have it cum in me next... No I can't think like that he's a student!]|<N1>*N<17>! I'm gonna...*;<command:change_view:ms-t-bj-cum><command:disable_loop><N17>[Still so much....]|<N17>*It's so good...*|<N1>What was that N<17>.|<N17> Oh nothing N<1>, just head to class.
<command:background:Desk><command:change_view:ms-t-bj><command:change_speed:4><N17>[At it again Trish...]|<N17>[Why does this have to turn me on...]|<N1>It's really nice that you keep helping me with this N<1>.|<N17>[I think I want it more than anything at this point....]|<N17>[Oh what have I become?];<command:change_speed:3><N17>[It just feels so good!]|<N17>Mmhmm!|<N1>It sounds like you like doing this.;<command:change_speed:2><N17>[I can't let him know that, I gotta hurry and finish!]|<N1>*N<17>... You're gonna make me cum like that!*|<N17>[Yes! Let's hurry and finish!];<command:change_speed:1><N17>[Let's make his dick cum...]|<N17>[Inside me....]|<N1>*N<17>! I'm gonna...*;<command:change_view:ms-t-bj-cum><command:disable_loop><N17>[So much.... So good.....]|<N17>*It's so nice...*|<N1>So you do like it?|<N17>Yes.... now head to class...
<command:background:Desk><command:change_view:ms-t-bj><command:change_speed:4><N17>[This is the best.]|<N17>[I can't stop doing this.]|<N17>[He knows I like it and so does he....|<N17>[It's no wonder why he keeps coming back.}|<N17>[And I hope he keeps coming!];<command:change_speed:3><N1>It feels so much better than before!|<N17>Mmhmm!|<N17>[It cause I love this, I can't help but get into it now.].;<command:change_speed:2><N17>[Unforunately I still need to end this quickly.]|<N17>[ We can't have someone walk in and end our fun right N<1>?]|<N17>[Now give me your cum!];<command:change_speed:1><N17>[I need to have this big dick.]|<N17>[I need to feel properly inside me.]|<N1>*N<17>! I'm gonna...*;<command:change_view:ms-t-bj-cum><command:disable_loop><N17>[Yes, fill my fucking mouth!]|<N17>*It's so good N<1>...*|<N1>I like it too. Thank you N<17>|<N17>Your welcome sweetie. Feel free to come do this again with me.
<command:background:Desk><command:change_view:ms-t-bj><command:change_speed:4><N17>[Fuck! Yes! I love sucking his cock]|<N17>[I'm so turned on. I have to resist getting him to fuck me right now.]|<N17>[Let's save that for after school!]|<N1>Oh N<17>, that feels amazing!|<N17>[That's what happens when a lady is really enjoying herself sweetie.];<command:change_speed:3><N1>*N<17> you're so intense now.*|<N17>Mmhmm!|<N17>[It's because I love your cock N<1>!];<command:change_speed:2><N1>*N<17>... If you go that fast I'm gonna...*|<N17>[Yes... Give me your delicious cum!];<command:change_speed:1><N17>[I love having this fat thing inside my mouth.]|<N17>[I really need him to fuck me after school!]|<N1>*N<17>! I'm gonna...*;<command:change_view:ms-t-bj-cum><command:disable_loop><N17>Oh fuck!|<N1>*N<17> careful! We have to be quiet.*|<N17>It's alright N<1>, I make sure to lock the doors whenever you come.|<N1>Really? You must really like doing this now!|<N17>Of course I do, now you better come back and do this tomorrow!
