0|13,,,
<command:background:DizzyBSPeterRoom><command:change_view:mom-back><command:change_speed:5><N2>[First we did it in the shower and now my son has me pinned down and is fucking me!]|<N2>[This is so unbelievible!]|<N2>[Did I do something wrong to have this happen to us?!];<command:change_speed:4><N1>N<2> your pussy feels really good!|<N1>I'm so happy that we could do it like this.|<N2>N<1>! I think it would better if you hush up while we do this!;<command:change_speed:3><N2>[This is already embarassing enough. Talking dirty would make it worse.]|<N2>[Even through it does feel good...]|<N2>[Wait no! This is so wrong! I'm his mother!]|<N2>[Yet the way he makes me feel...];<command:change_speed:2><N1>N<2> I'm going to cum.|<N2>Alright dear, just pull out now and cum on mommy's stomach or something.|<N1>It's too late!;<command:insert_sound:sex - Cumshot 4|100|100|1><command:disable_loop><command:change_view:mom-back-cum><N2>[Oh gosh! There is so much!]|<N1>That was amazing N<2>. Let's do it again sometime.|<N2>[While it felt good, I'm not sure we should be doing this again.],
<command:background:DizzyBSPeterRoom><command:change_view:mom-back><command:change_speed:5><N2>[Why does this have to feel so good?]|<N2>[I shouldn't be doing this again with my son.]|<N2>[But here am I doing it, and I'm enjoying it!];<command:change_speed:4><N1>Why can't all mothers be as amazing as you are N<2>?|<N2>I'm not sure N<1>.... It's alittle too taboo for most people I suppose....|<N1>I guess this really makes you better than the rest.;<command:change_speed:3><N2>[At least he's being sweet while we do this.]|<N2>[And well it does feel good to be doing this.]|<N2>[I should just try to make him happy, that is a mother's job.];<command:change_speed:2><N1>Your pussy feels so god N<2>.|<N1>It's make me cum again!|<N2>Pull out, pull out!|<N1>I'm cumming!;<command:insert_sound:sex - Cumshot 4|100|100|1><command:disable_loop><command:change_view:mom-back-cum><N2>[Why does being filled with my son's cum feel so good?]|<N2>So are you happy now N<1>?
<command:background:DizzyBSPeterRoom><command:change_view:mom-back><command:change_speed:5><N1>Are you enjoying this?|<N2>I-I am N<1>.|<N1>I'm glad I can make you feel as good as you make me.;<command:change_speed:4><N2>[You sweetheart...]|<N2>[I'd crush him but stoping this.]|<N2>[I guess it be okay if we keep doing this.];<command:change_speed:3><N2>I'm glad I can make you feel happy N<1>. It's a mother's job to make her children happy afterall.|<N2>And you always make mommy feel good when we do this. You make mommy feel special.|<N2>Pound mommy's pussy hard N<1>.;<command:change_speed:2><N2>Are you ready to cum dear?|<N2>You know to do it inside.|<N1>Ok N<2>. Here it comes!;<command:insert_sound:sex - Cumshot 4|100|100|1><command:disable_loop><command:change_view:mom-back-cum><N2>That amazing honey.|<N1>Really? Then can we keep doing this?|<N2>I think we can baby, I think we can.,,
<command:background:DizzyBSPeterRoom><command:enable_loop><command:change_view:mom-back><command:change_speed:5><N2>Do you like fucking mommy's pussy N<1>?|<N1>I love it N<2>. I wish we could do this all day.|<N2>Oh I wish we could too honey. But we have to settle just for doing this every night N<3> is out.;<command:change_speed:4><N2>I love when you have mommy on her back. It allows you to go as deep inside me as you can.|<N2>Having you pound my pussy is just amazing N<1>.|<N2>I can't believe how good it feels.;<command:change_speed:3><N2>I want you to fuck mommy even harder N<1>.|<N2>Don't hesitate.|<N2>Just do the best your body can do.;<command:change_speed:2><N2>I can fell your cock twitch inside me N<1>.|<N2>Go ahead and cum inside of mommy.|<N1>Alright N<2>. I'm about to blow!;<command:insert_sound:sex - Cumshot 4|100|100|1><command:disable_loop><command:change_view:mom-back-cum><N2>This is the best feeling that any mother could ask for.|<N2>A son who can make her feel so, so good.,,
<command:background:DizzyBSPeterRoom><command:enable_loop><command:change_view:mom-back><command:change_speed:5><N2>Oh N<1>! Baby it feels amazing!|<N2>Pound mommy's pussy so hard!|<N2>Go as hard and fast as you can N<1>!;<command:change_speed:4><N1>You are screaming pretty loudly N<2>. You must really like this don't you?|<N2>Yes baby! I can't get enough!|<N2>N<1>! Pound me harder! Please!;<command:change_speed:3><N2>I can't think of anything but your cock!|<N2>I'm in love with my son's massive cock!|<N2>Mommy's pussy belongs to her son's amazing cock!;<command:change_speed:2><N1>I'm about to fill your pussy up with my cum N<2>!|<N2>Oh N<1>! Give me all of it!|<N2>Make mommy feel amazing!;<command:insert_sound:sex - Cumshot 4|100|100|1><command:disable_loop><command:change_view:mom-back-cum><N2>My pussy is drenched in both our cum N<1>.|<N2>I couldn't have asked for a more generous son.,,,
