0|1
<command:background:PeterBedroomFloor><command:change_view:grandma-anal><N18>[Why did I agree to these lessons?]|<N18>[I should have known it would lead to something like this.]|<N18>[Did he unlock my old persona?];<command:change_speed:4><N1>It feels really good inside you N<18>.|<N18>Please don't say such naughty things sweetie. |<N1>But it's true! I love it!;<command:change_speed:3><N18>[He's so sweet.]|<N18>[But I can't keep letting him do this.]|<N18>[He is my grandson after all.];<command:change_speed:2><N1>N<18> Susie I'm going to cum.|<N1>Please take it all.|<N18>[I have no other choice sweetie...];<command:change_speed:1>[...];<command:change_view:grandma-anal-cum><command:play_sound:sex - Cumshot 4|80|100><command:disable_loop><N18>[There's so much cum in my rear.]|<N18>[I can't believe it but it feels pretty good.]|<N18>[I might end up wanting more...]
<command:background:PeterBedroomFloor><command:change_view:grandma-anal><N18>[I'm letting him do this again.]|<N18>[I'm surprised with myself.]|<N18>[He's got me doing such naughty things.];<command:change_speed:4><N1>I'm glad we got to do this again.|<N1>I really like it last time.|<N1>I hope you are enjoying this too N<18> Susie.;<command:change_speed:3><N18>[He's still so sweet and I think he's right. I am starting to enjoy this.]|<N18>[It's been so long since I've had sex like this.]|<N18>[I just never thought I'd end up doing it with my own grandson.];<command:change_speed:2><N1>I'm think I'm close N<18>.|<N1>Can I cum inside your ass again?|<N18>Language! Rear! You can cum inside my rear...;<command:change_speed:1>[...];<command:change_view:grandma-anal-cum><command:play_sound:sex - Cumshot 4|80|100><command:disable_loop><N18>[Yeah, there I got back in control.]|<N18>[Though I still ended up filled with his cum.] |<N18>[You really need to work harder on this Susan.]
<command:background:PeterBedroomFloor><command:change_view:grandma-anal><N18>Does it feel good N<1>?|<N18>I know this is the reason why you keep visiting me, just for our lessons. |<N1>I come cause I love you Grandma! ;<command:change_speed:4><N18>I love you too sweetie, but it's okay to tell the truth.|<N1>Okay I love fucking your ass N<18> Susie.|<N18>Ahem? What was that?;<command:change_speed:3><N1>I mean I love making love to you like this!|<N18>Much better.|<N18>Now keep thrusting into granny. ;<command:change_speed:2><N1> I'm going to cum N<18>.|<N1>I'm so close.|<N18>That's go N<1>. Just cum inside N<18>!;<command:change_speed:1>[...];<command:change_view:grandma-anal-cum><command:play_sound:sex - Cumshot 4|80|100><command:disable_loop><N18>That was wonderful N<1>.|<N18>I hope you enjoyed today's lesson cause I believe we might end up doing this again.|<N1>I can't wait N<18>!
<command:background:PeterBedroomFloor><command:change_view:grandma-anal><N18>Fuck me N<1>! Pound my ass with your fat cock!|<N1>Grandma! You're acting all naughty!|<N18>I don't care I just love doing this with you too much!;<command:change_speed:4><N18>Please keep doing this for granny.|<N1>I promise I will. It feels amazing. |<N1>You always make me feel so good.;<command:change_speed:3><N18>I'm glad I can N<1>.|<N18>You do the same to me.|<N18>You make me feel so good that I never want you to stop!;<command:change_speed:2><N1>But granny I have to cum!|<N18>Well alright sweetie. Go ahead and fill your grandma up.|<N18>Flood my tight old rear with your young cum!;<command:change_speed:1>[...];<command:change_view:grandma-anal-cum><command:play_sound:sex - Cumshot 4|80|100><command:disable_loop><N18>Another excellent lesson baby.|<N18>I'm certain on making this an everyday thing now.|<N18>Don't leave me waiting too long for when we do this again alright?
<command:background:PeterBedroomFloor><command:change_view:grandma-anal><N18>Do you like to fuck your grandmother N<1>?|<N18>I know love it. Give it to me harder N<1>.|<N18>I want you to pound my rear as hard as you can.;<command:change_speed:4><N1>Oh I love how tight it feels.|<N1>It feels so good. |<N1>I'm going to cum soon N<18> Susie.;<command:change_speed:3><N18>You like it that much huh?|<N18>Just don't cum yet.|<N18>Granny wants to make this lesson last as long as it can.;<command:change_speed:2><N18>Are you really that close?|<N18>Ahh darn, well go ahead and fill me up.|<N18>My ass is begging to be filled up with my grandson's lovely cum.;<command:change_speed:1>[...];<command:change_view:grandma-anal-cum><command:play_sound:sex - Cumshot 4|80|100><command:disable_loop><N18>Oh yes that is what granny wanted.|<N18>I can feel it deep inside me.|<N18>Make sure to come and see me for this lesson every day okay?
