0|7
<command:change_view:grandma-hj><N18>[I can't believe how big his cock is.]|<N18>[It feels even bigger than it looks.]|<N18>[I kinda like the way it feels while I hold it.];<command:change_speed:4><N18>[And the way he plays with my breasts is so nice]|<N18>[I'm sure any boy would like them though. Men love them big and soft like mine.]|<N18>[Oh! He's sucking them harder!];<command:change_speed:3><N18>[This... feels so nice.]|<N18>[I wonder if he's going to cum soon.]|<N1>N<18> I'm gonna cum!;<command:change_speed:2><N18>[Oh shit!]|<N18>D-don't worry baby. Granny took off her shirt so don't worry about a mess.|<N1>Gah! I'm cumming!;<command:insert_sound:sex - Cumshot 4|100|100|1><command:disable_loop><command:change_view:grandma-hj-cum><N18>[My god! There's so much cum.]|<N18>Alright sweet heart, how about we clean up and just enjoy the rest of our day?
<command:change_view:grandma-hj><N18>[I still can't believe how hard he is.]|<N18>[And he looks so cute suckling on me.]|<N18>[I bet he'll have the sweetest expression when he cums.];<command:change_speed:4><N1>You are really good at this N<18> Susie.|<N18>Thanks baby. I can tell that you're really enjoying yourself.|<N1>I want you to feel good too.;<command:change_speed:3><N18>[Aw he's so sweet to his grandmother.]|<N18>[Helping him out like this is actually fun.]|<N1>I hope I'm not bothering you by doing this N<18>.;<command:change_speed:2><N18>Don't worry. Granny likes this.|<N18>Just relax and let me take care of you.|<N1>N<18> I'm cumming!;<command:insert_sound:sex - Cumshot 4|100|100|1><command:disable_loop><command:change_view:grandma-hj-cum><N18>[Oh he looked so cute!]|<N18>[But there is so much cum, good thing I took off my sweater.]|<N18>Okay N<1>. Head home for now. I'll clean up.
<command:change_view:grandma-hj><N18>[It's hard to believe he still likes using my hand.]|<N18>[But I don't mind wrapping my hand around his cock.]|<N18>[Though I was kinda expecting he'd ask for something else at this point.];<command:change_speed:4><N18>I can see you still like my breasts.|<N1>I love them N<18>.|<N18>Good, but can you do me a favor and suck on them a bit harder.;<command:change_speed:3><N18>[Ahhh. That's more like it!]|<N18>I love your when you do this and I love your big cock.|<N1>N<18> that's naughty!;<command:change_speed:2><N18>Hehe. I know it is sweetie.|<N18>I know talking like that will make you enjoy yourself even more.|<N1>I'm cumming!;<command:insert_sound:sex - Cumshot 4|100|100|1><command:disable_loop><command:change_view:grandma-hj-cum><N18>See? I told you so baby.|<N18>Now run along. I'll take care of this mess.
<command:change_view:grandma-hj><N18>[It's hard to believe he still likes using my hand.]|<N18>[But I don't mind wrapping my hand around his cock.]|<N18>[Though I was kinda expecting he'd ask for something else at this point.];<command:change_speed:4><N18>I can see you still like my breasts.|<N1>I love them N<18>.|<N18>Good, but can you do me a favor and suck on them a bit harder.;<command:change_speed:3><N18>[Ahhh. That's more like it!]|<N18>I love your when you do this and I love your big cock.|<N1>N<18> that's naughty!;<command:change_speed:2><N18>Hehe. I know it is sweetie.|<N18>I know talking like that will make you enjoy yourself even more.|<N1>I'm cumming!;<command:insert_sound:sex - Cumshot 4|100|100|1><command:disable_loop><command:change_view:grandma-hj-cum><N18>See? I told you so baby.|<N18>Now run along. I'll take care of this mess.
<command:change_view:grandma-hj><N18>You like when I squeeze my hand on your hard cock?|<N18>It's so long and hard.|<N18>You want me milk all that cum you got in there?|<N18>Granny doesn't need an answer. She's just gonna do it anyways.;<command:change_speed:4><N18>Ahh! Keep suckling on me! I love the way it feels.|<N18>Suck your grandma's titties!|<N18>Suck hard. Nibble on them. Don't be afraid to be a little rough.;<command:change_speed:3><N1>Your hand feels so good.|<N18>I'm happy you like it.  You know it's been a long time since I did something like this.|<N1> That can't be true! You're still too sexy to not get any attention N<18> Susie!;<command:change_speed:2><N18>Oh you are too sweet to your dear old grandma.|<N18>I'll reward you by making you cum.|<N1>I'm cumming!;<command:insert_sound:sex - Cumshot 4|100|100|1><command:disable_loop><command:change_view:grandma-hj-cum><N18>Next time I want this all inside me.|<N18>Now though I'm going to lick up this mess.|<N18>You can stay and watch before you go.
